{
  "id": "edit:mock-insertion",
  "assembly": "GRCh38",
  "sequence_id": "chr22",
  "start": 100001,
  "end": 100001,
  "reference_allele": "",
  "edited_allele": "T",
  "edit_type": "insertion",
  "zygosity": "heterozygous",
  "mode": "germline",
  "edited_tissues": ["all"],
  "cell_fraction": 1.0,
  "delivery_modeled": false,
  "off_target_modeled": false
}
